{
  "$schema": "../schemas/ipa-conversion-profile.schema.json",
  "schema_version": "1.0.0",
  "provider_id": "epitran",
  "provider_version": "1.35.2",
  "profile_id": "hin-Deva",
  "profile_version": "1.0.0",
  "provider_kind": "external",
  "language": "hin",
  "input_normalization": "NFC",
  "output_notation": "IPA",
  "execution_boundary": "out-of-process",
  "packages": [{ "name": "epitran", "version": "1.35.2", "license": "MIT-Modern-Variant" }],
  "notes": "Pinned Hindi Devanagari profile. Review must cover inherent-vowel behavior, virama, nukta, combining marks, and schwa handling before confirmatory use."
}
