{
  "$schema": "../schemas/ipa-conversion-profile.schema.json",
  "schema_version": "1.0.0",
  "provider_id": "epitran",
  "provider_version": "1.35.2",
  "profile_id": "fas-Arab",
  "profile_version": "1.0.0",
  "provider_kind": "external",
  "language": "fas",
  "input_normalization": "NFC",
  "output_notation": "IPA",
  "execution_boundary": "out-of-process",
  "packages": [{ "name": "epitran", "version": "1.35.2", "license": "MIT-Modern-Variant" }],
  "notes": "Pinned Persian Perso-Arabic profile. UniMorph lemmas lacking explicit vowel marks are excluded as phonologically uncertain; this source remains exploratory and outside the frozen panel."
}
