{
  "$schema": "../schemas/ipa-conversion-profile.schema.json",
  "schema_version": "1.0.0",
  "provider_id": "epitran",
  "provider_version": "1.35.2",
  "profile_id": "hun-Latn",
  "profile_version": "1.0.0",
  "provider_kind": "external",
  "language": "hun",
  "input_normalization": "NFC",
  "output_notation": "IPA",
  "execution_boundary": "out-of-process",
  "packages": [
    {
      "name": "epitran",
      "version": "1.35.2",
      "license": "MIT-Modern-Variant"
    }
  ],
  "notes": "Epitran hun-Latn output is retained unchanged. Python UTF-8 mode is required on Windows. Compound boundary punctuation is removed from normalized orthography before conversion and recorded in source morphology metadata."
}
