{
  "$schema": "../schemas/ipa-conversion-profile.schema.json",
  "schema_version": "1.0.0",
  "provider_id": "epitran",
  "provider_version": "1.35.2",
  "profile_id": "tur-Latn",
  "profile_version": "1.0.0",
  "provider_kind": "external",
  "language": "tur",
  "input_normalization": "NFC",
  "output_notation": "IPA",
  "execution_boundary": "out-of-process",
  "packages": [
    {
      "name": "epitran",
      "version": "1.35.2",
      "license": "MIT-Modern-Variant"
    }
  ],
  "notes": "Epitran tur-Latn output is retained unchanged. Python UTF-8 mode is required on Windows. Unknown output segments, including unsupported circumflex orthography passed through by Epitran, block confirmatory use."
}
